{
  "nodeId": "nf-knowledge-evolution",
  "nodeType": "nonfiction",
  "data": {
    "label": "nf-knowledge-evolution",
    "chapterTitle": "The Way of the World?",
    "subtitle": "Knowledge Evolution and the Stories Animating AI",
    "complexity": "intermediate",
    "tags": [
      "knowledge evolution",
      "media transformation",
      "ai literacy",
      "technological transitions"
    ],
    "content": "<h2>Knowledge Evolution, System Transformation, and Thresholds of Change</h2>\n\n<p>Throughout history, each major shift in how humans share knowledge has transformed society. From spoken tales around a fire to today's intelligent machines, these transitions mark threshold moments in learning:</p>\n\n<h3>Oral Traditions</h3>\n<p>In ancient times, knowledge lived in people's memories and was passed on through speech and storytelling. This made learning deeply personal but also fragile – Socrates famously worried that writing would weaken our memory by outsourcing it to paper. Early societies had to rely on communal repetition and memorization, meaning knowledge could be lost or distorted over generations if people forgot or died.</p>\n\n<h3>The Written Word</h3>\n<p>The invention of writing (and later, the printing press) revolutionized knowledge transfer. Ideas could be recorded in books and scrolls, externalizing memory and preserving wisdom beyond any one person's lifetime. Writing reduced our need to memorize every fact and story, freeing up mental capacity for analysis. Over centuries, mass-produced print materials spread information widely, shrinking barriers of distance and time.</p>\n\n<h3>Mass Media & the Digital Era</h3>\n<p>The 20th century's radios, televisions, and finally the internet accelerated the reach of knowledge. A lecture, broadcast or webpage could instantaneously inform millions. By putting audio-visual and interactive content at our fingertips, these technologies increased engagement and made learning more accessible. Yet even the internet, with all its hyperlinked information, largely delivered static content – websites and videos present the same material to everyone, regardless of individual needs.</p>\n\n<h3>The AI Threshold</h3>\n<p>Now we stand at the next threshold: Artificial Intelligence as a new medium for knowledge. AI goes beyond being just another tool; it offers real-time interaction and adaptation. Unlike a book or even a website (which present fixed information), an AI can converse, personalize, and generate content on the fly based on a learner's questions and progress. This makes AI a fundamentally different mode of knowledge transfer – one that is dynamic and responsive.</p>\n\n<div class=\"info-box\">\n  <h4>Key Benefits of AI as a Learning Medium</h4>\n  <ul>\n    <li><strong>Immediacy:</strong> Instant feedback rather than waiting days for graded work</li>\n    <li><strong>Personalization:</strong> Content adjusts to individual learning styles and needs</li>\n    <li><strong>Inclusivity:</strong> Language barriers shrink with real-time translation</li>\n    <li><strong>Engagement:</strong> Dynamic simulations and \"what-if\" scenarios keep interest high</li>\n    <li><strong>Scalability:</strong> Every student can have personal support, impossible with human teachers alone</li>\n  </ul>\n</div>\n\n<h3>From Knowledge Acquisition to Knowledge Navigation</h3>\n<p>These benefits signal a shift in what skills are most important. In the past, education placed heavy emphasis on memorization – mastering facts, formulas, dates – because access to information was limited. After writing was adopted, rote memorization became a bit less crucial (you could always look something up in a library). Now, with the internet and especially AI, information is not only abundant but instantly retrievable. This trend marks \"the end of knowing enough.\" No individual can store all necessary knowledge in their head, nor do they need to. The value is shifting from what you know to how you can find out and use what is known. In other words, we are moving from knowledge acquisition to knowledge navigation.</p>\n\n<p>Knowledge navigation means being able to ask the right questions, find credible answers, and synthesize information to solve problems. It's a necessary response to the rapid rate of change in the world. When facts update and new ideas emerge constantly, the most important competency is learning how to keep learning. Continuous learning becomes the norm – not just for students but for adults throughout their careers.</p>\n\n<h3>New Media & Interactive Knowledge</h3>\n<p>Traditional media – whether printed books, radio broadcasts, or even most websites – can be described as \"flat\" or static media. They present content in a fixed form: once a book is printed or a video recorded, the information flow is one-way. The user can read or watch, but not influence the content itself.</p>\n\n<p>AI takes interactive media to the next level, effectively turning it into a polymorphic learning experience – one that can shape-shift based on each person's needs and preferences. There are multiple entry points to knowledge: some people prefer visual explanations, others learn better through stories or hands-on problem solving. AI can accommodate all these by presenting information in different forms.</p>\n\n<h3>Navigating Liminal Space</h3>\n<p>We find ourselves in a liminal period – a threshold between a familiar past and an uncertain future. Liminality in technological transition means living in two realities at once: one foot in the old world, one foot in the new. With AI's emergence, many people feel both wonder and worry.</p>\n\n<p>To navigate this in-between period, it's important to develop strategies for equilibrium – ways to keep ourselves and our communities balanced amid rapid change. One key strategy is education: AI literacy for all. The more people understand what AI can and cannot do, the less magical and intimidating it seems.</p>\n\n<div class=\"info-box\">\n  <h4>Strategies for Navigating AI Transition</h4>\n  <ul>\n    <li><strong>Education:</strong> Build AI literacy across all age groups</li>\n    <li><strong>Flexible adaptation:</strong> Practice being a beginner again with new technologies</li>\n    <li><strong>Support vulnerable groups:</strong> Identify who might be most affected by disruption</li>\n    <li><strong>Update mindsets:</strong> Move from \"old media thinking\" to \"new media thinking\"</li>\n    <li><strong>Build community resilience:</strong> Create support networks for those in transition</li>\n  </ul>\n</div>\n\n<p>In summary, humanity's journey from oral storytelling to artificial intelligence underscores an evolutionary pattern: each new medium of learning has expanded access and reduced the burden on the individual. With AI, the burden of memorization and one-size-fits-all teaching diminishes even further. Our relationship with knowledge is transforming – rather than hoarding facts, we focus on critical thinking, creativity, and learning how to learn.</p>"
  },
  "metadata": {
    "author": "System",
    "lastModified": "2025-03-23T12:00:00Z",
    "chapter": "chapter2"
  },
  "navigation": {
    "relatedFiction": [
      "ch1-scene1-restaurant",
      "ch1-scene2-alec-bedroom"
    ],
    "relatedConcepts": [
      "nf-ai-literacy",
      "nf-media-transformation",
      "nf-educational-paradigms"
    ],
    "alternateVersions": [],
    "relatedNonFiction": [],
    "previous": "preface-main",
    "next": "ch1-scene1-restaurant",
    "branchPoints": []
  }
}