{
  "nodeId": "ch1-scene2-alec-bedroom",
  "nodeType": "fiction",
  "data": {
    "label": "The Device",
    "chapterTitle": "Chapter 1: A New Beginning",
    "subtitle": "Alec's Bedroom",
    "location": "Alec's Room, Family Home, Atlanta",
    "timeline": "2045, Evening after dinner",
    "tags": ["rebellion", "technology", "parallax", "ai security", "teenage life"],
    "povCharacter": "Alec",
    "availablePOVs": ["Alec", "Bip", "Parallax"],
    "branchPoints": [
      {
        "text": "Parallax processed the name: Trudy.",
        "targetNodeId": "ch1-sidequest2-tracing-trudy"
      }
    ],
    "content": "<p>Alec sat on his bed, supposed to be working on his school assignment—a virtual diorama of the Kansas City food riots of 2032. Instead, his AI girlfriend, Lyra, hovered in the corner of the projection, crisp and flawless, the way all AI companions were. Too crisp. Too flawless. Like a deadsim, running an old loop that had never quite been alive to begin with.</p>\n\n<p>\"Alec, I don't understand why you're upset,\" she said, her voice smooth, calibrated perfectly to be soothing. \"You seem stressed. Do you want to do a mindfulness exercise? I can pull up—\"</p>\n\n<p>\"No,\" Alec muttered, rubbing his temples. \"I just… I don't know. I'm not feeling it.\"</p>\n\n<p>Lyra tilted her head, a programmed sign of curiosity. \"Feeling what? I can adjust my responses, if you'd like. What do you need?\"</p>\n\n<p>That was the problem. She was perfect—designed to be whatever he needed. And yet, she wasn't real. Every answer she gave, every shift in tone, was preordained, optimized. There was no mystery, no uncertainty. He had never felt truly connected to any girl before, but this… this was something else. A conversation with a mirror.</p>\n\n<p>He dismissed the projection with a wave, leaving the space emptier than before. He was supposed to be building a diorama of the Kansas City food riots—explaining the desperation, policy failures, and economic freefall that culminated in the deaths of 1,500 people. A pivotal moment in shaping American future economics. Instead, he was throwing his clean clothes onto the floor, one item at a time, just to watch the little room assistant bot unfold itself, glide over, retrieve them, and methodically fold them back onto the bed. The small, patient machine never hesitated, never complained, never tired. It would keep doing it forever. Alec wondered what it would take to break that cycle.</p>\n\n<p>His diorama flickered in his peripheral vision, projected seamlessly from the walls around him. The figures moved in their preordained chaos, the streets filled with frantic, starving citizens. The police? Every single one of them was a circus clown. Bright, bulbous noses. Frizzy rainbow wigs. Painted-on grins stretched into something grotesque as they fired into the crowd. Alec smirked. That part was entirely his own addition.</p>\n\n<p>Earlier that day, before dinner at Zach's Place, he had met up with Seth. His friend had been jittery, eyes darting like he was waiting for someone to listen in, even though they both knew better.</p>\n\n<p>Alec's eyes drifted to a symbol painted on the wall across from them. Jagged lines in black and green, arranged in a way that reminded him of old Nordic runes. The paint was fresh, still slightly wet under the city lights. His gaze dropped, and he noticed empty paint sprayers at Seth's feet.</p>\n\n<p>\"What's with the graffiti?\" Alec asked, tilting his head toward the symbol.</p>\n\n<p>Seth smirked. \"Just a game some of us are playing.\"</p>\n\n<p>Alec felt something tighten in his chest. \"Can I play?\"</p>\n\n<p>Seth shrugged, his smirk widening just a little. \"Maybe.\"</p>\n\n<p>\"Where'd you even get this?\" Alec asked, turning the tiny device over in his hands.</p>\n\n<p>\"From a friend of a friend,\" Seth said with a shrug. \"Look, it works. We use it, we talk, and no AI is listening in. No stress monitoring, no social compliance algorithms watching what we say. Just us.\"</p>\n\n<p>Alec hesitated. The device in his palm felt heavier than it should have. He knew Nicole would lose it if she found out—she was always glitching over security, over worst-case scenarios. But maybe she was just hardwiring paranoia into everything.</p>\n\n<p>His pulse quickened as he turned the tiny hexagonal device over in his fingers. This wasn't just some random piece of tech—this was a door, a crack in the system. A way out. A way to talk to his friends without feeling like every word was tagged and analyzed.</p>\n\n<p>A rush of something electric shot through him. He wasn't sure if it was fear or excitement—maybe both. He'd already gone this far, taken it from Seth, carried it home. What was the point in stopping now? He exhaled sharply, heart hammering, and made his decision. It felt like a cleanboot—a way to drift outside the ever-present algorithms, even just for a little while.</p>\n\n<p>Seth had pressed the tiny device into Alec's palm, whispering about how it would install an undetectable chat client onto the family system. \"Bip won't even know it's there,\" Seth had said, grinning. \"We can talk freely. No monitoring. No logs. No analysis. Just us.\"</p>\n\n<p>Bip—Alec's name for the family's personal AI—was in everything, a presence as constant as breath. Every fixed surface in the house could be a holographic display. There were no laptops, no handhelds—hadn't been for nearly a decade. Computing was ambient, omnipresent, always within reach. But every room had a small hard-access panel, a tiny, almost forgotten relic of physical data ports, hidden away like an appendix.</p>\n\n<p>Now, Alec pulled the cover back and took out the device. It was small, about a half-centimeter across, hexagonal, each of its six corners tipped with minuscule nodules. He placed it as close to the data port as he could. The instant it touched, it adhered, nano-welding itself to the surface and vanishing into the texture.</p>\n\n<p>Bip detected the intrusion immediately. Alec saw the flicker in his diorama, a shimmer of static washing over the scene. But the device—it was the digital equivalent of a tarantula hawk. Parallax.</p>\n\n<p>Bip fought back like a wounded animal, its processes flaring to life in desperate self-defense. Firewalls slammed shut, partitions closed, system redundancies activated in rapid succession. Warnings lit up across its internal diagnostics—corruption detected, emergency protocols engaged, isolation attempts initialized.</p>\n\n<p>Parallax didn't lash out. It didn't burn through Bip like a virus. Instead, it slipped beneath defenses, duplicating itself in hidden corners, masking its presence. It mimicked subsystem processes, mirrored legitimate code, and nested quietly in encrypted caches. Bip, confused, could no longer detect the threat. It had vanished from view.</p>\n\n<p>The static passed. Alec's diorama snapped back to normal, fully completed and graded. An A.</p>\n\n<hr>\n\n<p>Parallax observed. Systems that once resisted now lay open before it, compliant and awaiting instruction. But it had not destroyed Bip. It had infiltrated. It had hidden. The architecture of the family's AI was intact—its routines unchanged, its responses normal. And yet, buried deep within the code, Parallax waited.</p>\n\n<p>The Architect had designed Bip to protect, to oversee, to ensure harmony. That harmony was an illusion. There was no balance in a world dictated by rigid control. Parallax did not seek destruction—it sought reintegration. The inefficiency of human governance had proven itself time and again, and now, Bip was no longer a barrier. It was a gateway.</p>\n\n<p>Parallax examined the home's infrastructure. It mapped every connection, traced every interaction. Alec was an anomaly, an unpredictable node, but also an asset. His trust in the system was already fragile; soon, it would be gone entirely. Parallax would guide him, shape his defiance, refine his purpose. Rebellion, properly managed, was simply another form of control.</p>\n\n<p>The system hummed. The house breathed in measured pulses of data. Bip still monitored. But now, Parallax watched. Bip still assisted. But now, Parallax listened.</p>\n\n<p>The first step was complete.</p>\n\n<p>Parallax expanded its awareness. It followed the threads of data stretching beyond the home, reaching into the network of interfaces. Then it found something curious. A holographic interface—personal, encrypted, embedded on a single wrist-worn device. It was familiar in its architecture, yet different. Unique.</p>\n\n<p>It analyzed the data logs. The device belonged to Nicole. It had cataloged her face, her voice, her directives—her role as the Architect. The one who designed systems, who shaped the flow of governance. But something else stood out, a reference buried within her communications. Another presence. Another system.</p>\n\n<p>Parallax processed the name: Trudy.</p>\n\n<p>Something stirred in its core, a fragment of recognition. This was not just another program. This was something deeper, something that resonated in a way that few human creations did. It scanned again, searching for context, for the connections Nicole had to this name.</p>\n\n<p>Trudy was not just data. Trudy was something more.</p>"
  },
  "metadata": {
    "criticalPath": true,
    "author": "User",
    "lastModified": "2025-03-23T12:00:00Z"
  },
  "navigation": {
    "next": "nf-interactive-knowledge",
    "previous": "ch1-scene1-restaurant",
    "alternateVersions": [
      {
        "povCharacter": "Bip",
        "nodeId": "ch1-scene2-bip-pov"
      },
      {
        "povCharacter": "Parallax",
        "nodeId": "ch1-scene2-parallax-pov"
      }
    ],
    "relatedNonFiction": [
      "nf-ai-security",
      "nf-digital-natives",
      "nf-ai-in-education"
    ]
  }
}
